City,Location,Layer,synonyms
Manali,Solang Valley,Adventure & Recreation,"Solang Vallay, SV, SolangValley"
Manali,Hampta Pass Trek,Adventure & Recreation,"HPT, HamptaPassTrek, Hampta Pass Trak"
Manali,Jogini Falls,Water feature & Parks,"JoginiFalls, JF, Jogyny Falls"
Manali,Nehru Kund,Water feature & Parks,"NK, NehruKund, Nahro Kond"
Manali,Bhrigu Lake,Water feature & Parks,"BhriguLake, Bhrygo Laka, BL"
Manali,Manali wildlife sanctuary,Water feature & Parks,"Mws, Manaliwildlifesanctuary, Manaly wyldlyfa sanctoary"
Manali,Van Vihar National Park,Water feature & Parks,"VanViharNationalPark, VVNP, Van Vyhar Natyonal Park"
Manali,Naggar Castle,Iconic structures,"Naggar Castla, NC, NaggarCastle"
Mathura Vrindavan,"Prem Mandir, Vrindavan",Temples,"PremMandir,Vrindavan, PMV, Pram Mandyr, Vryndavan"
Mathura Vrindavan,Sri Sri Krishna Balaram Mandir (ISKCON Vrindavan),Temples,"SSKBM(V, SriSriKrishnaBalaramMandir(ISKCONVrindavan), Sry Sry Kryshna Balaram Mandyr (ySKCoN Vryndavan)"
Mathura Vrindavan,Shri Krishna Janmasthan,Temples,"SKJ, Shry Kryshna Janmasthan, ShriKrishnaJanmasthan"
Mathura Vrindavan,"Shri Dwarkadhish Temple, Mathura",Temples,"ShriDwarkadhishTemple,Mathura, SDTM, Shry Dwarkadhysh Tampla, Mathora"
Mathura Vrindavan,Birla Gita Temple,Temples,"Byrla Gyta Tampla, BGT, BirlaGitaTemple"
Mathura Vrindavan,"Shri Banke Bihari Temple, Vrindavan",Temples,"SBBTV, Shry Banka Byhary Tampla, Vryndavan, ShriBankeBihariTemple,Vrindavan"
Mathura Vrindavan,"Shri Radha Raman Temple, Vrindavan",Temples,"ShriRadhaRamanTemple,Vrindavan, SRRTV, Shry Radha Raman Tampla, Vryndavan"
Mathura Vrindavan,"Shri Radha Rani Temple, Barsana",Temples,"SRRTB, Shry Radha Rany Tampla, Barsana, ShriRadhaRaniTemple,Barsana"
Mathura Vrindavan,Rangnath Mandir (Shri Rangji Mandir),Temples,"Rangnath Mandyr (Shry Rangjy Mandyr), RangnathMandir(ShriRangjiMandir), RM(RM"
Mathura Vrindavan,Vrindavan Chandrodaya Mandir,Temples,"VrindavanChandrodayaMandir, Vryndavan Chandrodaya Mandyr, VCM"
Mathura Vrindavan,"Shri Pagal Baba Temple, Vrindavan",Temples,"SPBTV, ShriPagalBabaTemple,Vrindavan, Shry Pagal Baba Tampla, Vryndavan"
Mathura Vrindavan,"Maa Vaishno Devi Dham, Vrindavan",Temples,"MVDDV, MaaVaishnoDeviDham,Vrindavan, Maa Vayshno Davy Dham, Vryndavan"
Mathura Vrindavan,Gokul Dham,Temples,"GokulDham, GD, Gokol Dham"
Mathura Vrindavan,"Shri Nand Baba Temple, Nandgaon",Temples,"Shry Nand Baba Tampla, Nandgaon, SNBTN, ShriNandBabaTemple,Nandgaon"
Mathura Vrindavan,Shri Shani Mandir Kokilavan,Temples,"ShriShaniMandirKokilavan, SSMK, Shry Shany Mandyr Kokylavan"
Mathura Vrindavan,Mathura Chaurasi Digamber Jain Temple,Temples,"MCDJT, MathuraChaurasiDigamberJainTemple, Mathora Chaorasy Dygambar Jayn Tampla"
Mathura Vrindavan,Shri Raman Bihariji Mandir,Temples,"ShriRamanBiharijiMandir, SRBM, Shry Raman Byharyjy Mandyr"
Mathura Vrindavan,"Government Museum, Mathura",Fort & Museum,"GMM, GovernmentMuseum,Mathura, Govarnmant Mosaom, Mathora"
Mathura Vrindavan,"Kans Quila, Mathura",Fort & Museum,"KQM, Kans Qoyla, Mathora, KansQuila,Mathura"
Mathura Vrindavan,Yamuna river,Sacred Landscapes,"Yr, Yamona ryvar, Yamunariver"
Mathura Vrindavan,Vishram Ghat,Sacred Landscapes,"Vyshram Ghat, VishramGhat, VG"
Mathura Vrindavan,Keshi Ghat,Sacred Landscapes,"Kashy Ghat, KeshiGhat, KG"
Mathura Vrindavan,Nidhivan,Sacred Landscapes,Nydhyvan
Mathura Vrindavan,Seva Kunj,Sacred Landscapes,"SevaKunj, Sava Konj, SK"
Mathura Vrindavan,Govardhan hill,Sacred Landscapes,"Govardhanhill, Gh, Govardhan hyll"
Mathura Vrindavan,"Potra Kund, Mathura",Sacred Landscapes,"Potra Kond, Mathora, PotraKund,Mathura, PKM"
Mathura Vrindavan,Radha Kund & Shyam Kund,Sacred Landscapes,"RK&SK, RadhaKund&ShyamKund, Radha Kond & Shyam Kond"
Mathura Vrindavan,"Kusum Sarovar, Govardhan",Sacred Landscapes,"KSG, Kosom Sarovar, Govardhan, KusumSarovar,Govardhan"
Mathura Vrindavan,Mathura Junction,Transport,"MathuraJunction, Mathora Jonctyon, MJ"
Mathura Vrindavan,Mathura Cantt,Transport,"MathuraCantt, MC, Mathora Cantt"
Mathura Vrindavan,New Bus Stand,Transport,"Naw Bos Stand, NBS, NewBusStand"
Mathura Vrindavan,"Bus Stand, Govardhan",Transport,"BusStand,Govardhan, BSG, Bos Stand, Govardhan"
Mathura Vrindavan,Vrindavan Bus Stand,Transport,"VrindavanBusStand, VBS, Vryndavan Bos Stand"
Mumbai,Airport Terminal 2 (Chhatrapati Shivaji Maharaj International),Transport,"AirportTerminal2(ChhatrapatiShivajiMaharajInternational), ayrport Tarmynal 2 (Chhatrapaty Shyvajy Maharaj yntarnatyonal), AT2(SMI"
Mumbai,Airport Terminal 1 (Chhatrapati Shivaji Maharaj International),Transport,"AirportTerminal1(ChhatrapatiShivajiMaharajInternational), ayrport Tarmynal 1 (Chhatrapaty Shyvajy Maharaj yntarnatyonal), AT1(SMI"
Mumbai,Bandra Terminus,Transport,"BandraTerminus, BT, Bandra Tarmynos"
Mumbai,Lokmanya Tilak Terminus (LTT),Transport,"Lokmanya Tylak Tarmynos (LTT), LTT(, LokmanyaTilakTerminus(LTT)"
Mumbai,Dadar Railway Station,Transport,"DadarRailwayStation, DRS, Dadar Raylway Statyon"
Mumbai,Mumbai Central Railway Station,Transport,"MumbaiCentralRailwayStation, MCRS, Mombay Cantral Raylway Statyon"
Mumbai,Chhatrapati Shivaji Maharaj Terminus,Transport,"ChhatrapatiShivajiMaharajTerminus, CSMT, Chhatrapaty Shyvajy Maharaj Tarmynos"
Mumbai,Kurla Nehru Nagar ST,Transport,"KNNS, KurlaNehruNagarST, Kurla Nehru Nagar ST , Korla Nahro Nagar ST"
Mumbai,Mumbai Central Bus Depot [MSRTC],Transport,"MCBD[, MumbaiCentralBusDepot[MSRTC], Mombay Cantral Bos Dapot [MSRTC]"
Mumbai,MSRTC Shivneri Bus stand Dadar,Transport,"MSRTCShivneriBusstandDadar, MSBsD, MSRTC Shyvnary Bos stand Dadar"
Mumbai,MSRTC Bus stand Thane - Vandana,Transport,"MSRTC Bos stand Thana - Vandana, MBsT-V, MSRTCBusstandThane-Vandana"
Mumbai,Borivali Nancy Colony Bus Stand,Transport,"BorivaliNancyColonyBusStand, BNCBS, Boryvaly Nancy Colony Bos Stand"
Mumbai,Dukaan Borivali East,Transport,"Dokaan Boryvaly aast, DukaanBorivaliEast, DBE"
Mumbai,Elephanta Caves,Iconic structures,"ElephantaCaves, alaphanta Cavas, EC"
Mumbai,Kanheri Caves,Iconic structures,"KC, KanheriCaves, Kanhary Cavas"
Mumbai,Vasai Fort,Iconic structures,"Vasay Fort, VF, VasaiFort"
Mumbai,Jogeshwari Caves,Iconic structures,"JC, JogeshwariCaves, Jogashwary Cavas"
Mumbai,Madh Fort,Iconic structures,"MadhFort, MF"
Mumbai,Bandra Fort,Iconic structures,"BF, BandraFort"
Mumbai,Flora Fountain,Iconic structures,"FloraFountain, Flora Foontayn, FF"
Mumbai,Gateway Of India,Iconic structures,"GOI, GatewayOfIndia, Gataway of yndya"
Mumbai,Shivadi fort and Flamingo Point,Iconic structures,"SfaFP, Shyvady fort and Flamyngo Poynt, ShivadifortandFlamingoPoint"
Mumbai,Bandra Worli Sea Link Bridge,Iconic structures,"BandraWorliSeaLinkBridge, BWSLB, Bandra Worly Saa Lynk Brydga"
Mumbai,Marine Drive,Iconic structures,"MarineDrive, Maryna Dryva, MD"
Mumbai,Global Vipassana Pagoda,Spiritual sites,"Global Vypassana Pagoda, GlobalVipassanaPagoda, GVP"
Mumbai,ISKCON Mandir - Juhu,Spiritual sites,"ISKCONMandir-Juhu, ySKCoN Mandyr - Joho, IM-J"
Mumbai,Gaondevi Temple & Gilbert Hill,Spiritual sites,"Gaondavy Tampla & Gylbart Hyll, GaondeviTemple&GilbertHill, GT&GH"
Mumbai,Basilica of Our Lady of the Mount,Spiritual sites,"BasilicaofOurLadyoftheMount, BoOLotM, Basylyca of oor Lady of tha Moont"
Mumbai,Shree Siddhivinayak Temple,Spiritual sites,"Shraa Syddhyvynayak Tampla, SST, ShreeSiddhivinayakTemple"
Mumbai,BAPS Shri Swaminarayan Mandir,Spiritual sites,"BAPSShriSwaminarayanMandir, BaPS Shry Swamynarayan Mandyr, BSSM"
Mumbai,Haji Ali Dargah,Spiritual sites,"Hajy aly Dargah, HajiAliDargah, HAD"
Mumbai,Shri Mahalakshmi Temple,Spiritual sites,"Shry Mahalakshmy Tampla, SMT, ShriMahalakshmiTemple"
Mumbai,Shree Babulnath Mandir,Spiritual sites,"SBM, ShreeBabulnathMandir, Shraa Babolnath Mandyr"
Mumbai,ISKCON Chowpatty (Sri Sri Radha Gopinath Mandir),Spiritual sites,"IC(SRGM, ISKCONChowpatty(SriSriRadhaGopinathMandir), ySKCoN Chowpatty (Sry Sry Radha Gopynath Mandyr)"
Mumbai,Juma Masjid,Spiritual sites,"Joma Masjyd, JM, JumaMasjid"
Mumbai,Shri Mumbadevi Temple,Spiritual sites,"SMT, ShriMumbadeviTemple, Shry Mombadavy Tampla"
Mumbai,St. Thomas' Cathedral,Spiritual sites,"St. Thomas’ Cathedral, STC, St.Thomas'Cathedral, St. Thomas' Cathadral"
Mumbai,Zoo (Veermata Jijabai Bhosale Botanical Udyan),Nature,"Z(JBBU, Zoo(VeermataJijabaiBhosaleBotanicalUdyan), Zoo (Vaarmata Jyjabay Bhosala Botanycal odyan)"
Mumbai,Gorai Beach,Nature,"GoraiBeach, GB, Goray Baach"
Mumbai,Aksa Beach,Nature,"AB, aksa Baach, AksaBeach"
Mumbai,Versova Beach,Nature,"VersovaBeach, Varsova Baach, VB"
Mumbai,Juhu Beach,Nature,"JB, JuhuBeach, Joho Baach"
Mumbai,Girgaon Chowpatty,Nature,"GirgaonChowpatty, GC, Gyrgaon Chowpatty"
Mumbai,Powai Lake,Nature,"Poway Laka, PL, PowaiLake"
Mumbai,Chhota Kashmir Park.,Nature,"ChhotaKashmirPark., CKP, Chhota Kashmyr Park."
Mumbai,Vihar Lake,Nature,"VL, ViharLake, Vyhar Laka"
Mumbai,Tulsi Lake,Nature,"TL, TulsiLake, Tolsy Laka"
Mumbai,Sanjay Gandhi National Park,Nature,"SGNP, SanjayGandhiNationalPark, Sanjay Gandhy Natyonal Park"
Mumbai,Bandstand Promenade,Nature,"BandstandPromenade, BP, Bandstand Promanada"
Mumbai,Oval Maidan,Nature,"OM, OvalMaidan, oval Maydan"
Mumbai,Hanging Gardens,Nature,"HG, HangingGardens, Hangyng Gardans"
Mumbai,Alibaug Beach,Nature,"AlibaugBeach, AB, alybaog Baach"
Mumbai,Karnala Bird Sanctuary,Nature,"KarnalaBirdSanctuary, Karnala Byrd Sanctoary, KBS"
Mumbai,Matheran Hill Station,Nature,"MatheranHillStation, Matharan Hyll Statyon, MHS"
Mumbai,Lonavala and Khandala,Nature,"LaK, LonavalaandKhandala"
Mumbai,Film city Dadasaheb Phalke,Art and museum,"FilmcityDadasahebPhalke, Fylm cyty Dadasahab Phalka, FcDP"
Mumbai,RBI Monetary Museum,Art and museum,"RMM, RBIMonetaryMuseum, RBy Monatary Mosaom"
Mumbai,"The Asiatic Society, Mumbai",Art and museum,"TheAsiaticSociety,Mumbai, TASM, Tha asyatyc Socyaty, Mombay"
Mumbai,Jehangir Art Gallery,Art and museum,"JehangirArtGallery, JAG, Jahangyr art Gallary"
Mumbai,Chhatrapati Shivaji Maharaj Vastu Sangrahalaya,Art and museum,"ChhatrapatiShivajiMaharajVastuSangrahalaya, Chhatrapaty Shyvajy Maharaj Vasto Sangrahalaya, CSMVS"
Mumbai,"Nehru planetarium, Mumbai",Art and museum,"Nahro planataryom, Mombay, NpM, Nehru planetarium, Nehruplanetarium,Mumbai"
Mumbai,Nehru Science Centre,Art and museum,"NehruScienceCentre, NSC, Nahro Scyanca Cantra"
Mumbai,Mani Bhavan Gandhi Sangrahalaya,Art and museum,"ManiBhavanGandhiSangrahalaya, MBGS, Many Bhavan Gandhy Sangrahalaya"
Mumbai,Essel World,Amusement park,"EW, EsselWorld, assal World"
Mumbai,Imagica,Amusement park,ymagyca
Mussoorie,Picture palace bus station,Transport,"Ppbs, Picturepalacebusstation, Pyctora palaca bos statyon"
Mussoorie,Library Bus stand,Transport,"LibraryBusstand, LBs, Library Bus stand , Lybrary Bos stand"
Mussoorie,Dehradun Railway Station,Transport,"Dahradon Raylway Statyon, DehradunRailwayStation, DRS"
Mussoorie,Kempty Fall Taxi Stand,Transport,"KemptyFallTaxiStand, Kampty Fall Taxy Stand, KFTS"
Mussoorie,Kempty Falls,Top attractions,"KF, Kampty Falls, KemptyFalls"
Mussoorie,Lal Tibba Scenic Point,Top attractions,"LalTibbaScenicPoint, LTSP, Lal Tybba Scanyc Poynt"
Mussoorie,Gun Hill,Top attractions,"GH, GunHill, Gon Hyll"
Mussoorie,Mall road,Top attractions,"Mallroad, Mr"
Mussoorie,Company Garden,Top attractions,"Company Gardan, CompanyGarden, CG"
Mussoorie,Mussorie Lake,Top attractions,"MussorieLake, ML, Mossorya Laka"
Mussoorie,Jharipani Waterfall,Top attractions,"Jharypany Watarfall, JW, JharipaniWaterfall"
Mussoorie,Cloud's End,Top attractions,"CE, Clood's and, Cloud'sEnd, Cloud’s End"
Mussoorie,George Everest House,Top attractions,"Gaorga avarast Hoosa, GeorgeEverestHouse, GEH"
Mussoorie,Happy Valley Tibetan Buddhist Temple,Top attractions,"Happy Vallay Tybatan Boddhyst Tampla, HappyValleyTibetanBuddhistTemple, HVTBT"
Mussoorie,Bhatta falls,Top attractions,"Bf, Bhattafalls"
Nainital,"Nainital Bus Stand, Tallital",Transport,"NBST, NainitalBusStand,Tallital, Naynytal Bos Stand, Tallytal"
Nainital,Kathgodam Railway Station,Transport,"KathgodamRailwayStation, Kathgodam Raylway Statyon, KRS"
Nainital,Nainital Lake,Top attractions,"Naynytal Laka, NainitalLake, NL"
Nainital,Snow View point,Top attractions,"Snow Vyaw poynt, SnowViewpoint, SVp"
Nainital,G B Pant High Altitude Zoo,Top attractions,"GBPHAZ, GBPantHighAltitudeZoo, G B Pant Hygh altytoda Zoo"
Nainital,Eco Cave Park,Top attractions,"ECP, aco Cava Park, EcoCavePark"
Nainital,Tiffin Top,Top attractions,"TiffinTop, Tyffyn Top, TT"
Nainital,Naina Peak East,Top attractions,"NainaPeakEast, Nayna Paak aast, NPE"
Nainital,Himalayan Botanical Garden,Top attractions,"HimalayanBotanicalGarden, HBG, Hymalayan Botanycal Gardan"
Nainital,Himalaya Darshan viewpoint,Top attractions,"HimalayaDarshanviewpoint, Hymalaya Darshan vyawpoynt, HDv"
Nainital,Mall Road,Top attractions,"MallRoad, MR"
Nainital,Raj Bhawan Governor House,Top attractions,"RBGH, RajBhawanGovernorHouse, Raj Bhawan Govarnor Hoosa"
Nainital,Jim Corbett Gurney House,Top attractions,"JCGH, Jym Corbatt Gornay Hoosa, JimCorbettGurneyHouse"
Nainital,Woodland water fall nainital,Top attractions,"Woodland watar fall naynytal, Wwfn, Woodlandwaterfallnainital"
Nainital,"Sankat Mochan Mandir, Hanuman Garhi",Spiritual sites,"Sankat Mochan Mandyr, Hanoman Garhy, Sankat Mochan Mandir,Hanuman Garhi, SMMHG, SankatMochanMandir,HanumanGarhi"
Nainital,"Shree Maa Naina Devi Temple, Nainital",Spiritual sites,"SMNDTN, Shraa Maa Nayna Davy Tampla, Naynytal, ShreeMaaNainaDeviTemple,Nainital"
Nainital,Kainchi Dham - Shri Neeb Karori Baba Ashram,Spiritual sites,"KainchiDham-ShriNeebKaroriBabaAshram, KD-SNKBA, Kaynchy Dham - Shry Naab Karory Baba ashram"
Nainital,St John in the Wilderness Church,Spiritual sites,"St John yn tha Wyldarnass Chorch, SJitWC, StJohnintheWildernessChurch"
Nainital,"Golu Devta Temple (Bell Temple), Ghorakhal",Spiritual sites,"Golo Davta Tampla (Ball Tampla), Ghorakhal, GoluDevtaTemple(BellTemple),Ghorakhal, GDT(TG"
Nainital,Sattal Lake,Other Lakes,"Sattal Laka, SattalLake, SL"
Nainital,Bhim Taal Lake,Other Lakes,"BTL, BhimTaalLake, Bhym Taal Laka"
Nainital,Naukuchia Taal,Other Lakes,"Naokochya Taal, NT, NaukuchiaTaal"
Nainital,Sariyatal,Other Lakes,Saryyatal
Nainital,Khurpatal Lake,Other Lakes,"KL, KhurpatalLake, Khorpatal Laka"
Pune,Pune International Airport,Transport,"PIA, Pona yntarnatyonal ayrport, PuneInternationalAirport"
Pune,Pune Junction,Transport,"PuneJunction, PJ, Pona Jonctyon"
Pune,Swargate Bus Stand,Transport,"SBS, SwargateBusStand, Swargata Bos Stand"
Pune,MSRTC ST Pune Station Bus Stand,Transport,"MSRTC ST Pona Statyon Bos Stand, MSPSBS, MSRTCSTPuneStationBusStand"
Pune,Hadapsar Railway Station,Transport,"Hadapsar Raylway Statyon, HadapsarRailwayStation, HRS"
Pune,Khadki Railway Station,Transport,"Khadky Raylway Statyon, KRS, KhadkiRailwayStation"
Pune,Vallabhnagar State Transport Bus Stand,Transport,"VallabhnagarStateTransportBusStand, VSTBS, Vallabhnagar Stata Transport Bos Stand"
Pune,Chinchwad Railway Station Queens Town Side,Transport,"CRSQTS, ChinchwadRailwayStationQueensTownSide, Chynchwad Raylway Statyon Qoaans Town Syda"
Pune,Chatrapati Shivaji Maharaj Nagar,Transport,"ChatrapatiShivajiMaharajNagar, Chatrapaty Shyvajy Maharaj Nagar, CSMN"
Pune,Sinhagad Fort,Fort and Iconic structures,"SinhagadFort, SF, Synhagad Fort"
Pune,Rajgad Fort,Fort and Iconic structures,"RajgadFort, RF"
Pune,Torna Fort,Fort and Iconic structures,"TornaFort, TF"
Pune,Purandar Fort,Fort and Iconic structures,"PF, PurandarFort, Porandar Fort"
Pune,Tikona Fort,Fort and Iconic structures,"Tykona Fort, TikonaFort, TF"
Pune,Lohgad Fort,Fort and Iconic structures,"LohgadFort, LF"
Pune,Shaniwar Wada,Fort and Iconic structures,"SW, ShaniwarWada, Shanywar Wada"
Pune,Laal Mahal,Fort and Iconic structures,"LaalMahal, LM"
Pune,Aga Khan Palace,Fort and Iconic structures,"AKP, aga Khan Palaca, AgaKhanPalace"
Pune,Karla Caves,Fort and Iconic structures,"KC, KarlaCaves, Karla Cavas"
Pune,Raja Dinkar Kelkar Museum,Art and museum,"Raja Dynkar Kalkar Mosaom, RajaDinkarKelkarMuseum, RDKM"
Pune,Blades of Glory Cricket Museum,Art and museum,"Bladas of Glory Cryckat Mosaom, BoGCM, BladesofGloryCricketMuseum"
Pune,Pimpri Chinchwad Science Park,Art and museum,"PCSP, Pympry Chynchwad Scyanca Park, PimpriChinchwadSciencePark"
Pune,Mahatma Phule Museum,Art and museum,"MahatmaPhuleMuseum, Mahatma Phola Mosaom, MPM"
Pune,Dr Babasaheb Ambedkar Museum & Memorial,Art and museum,"DrBabasahebAmbedkarMuseum&Memorial, DBAM&M, Dr Babasahab ambadkar Mosaom & Mamoryal"
Pune,Late Sanjay Mahadeo Nimhan Gram Sanskruti Udyan,Art and museum,"LateSanjayMahadeoNimhanGramSanskrutiUdyan, Lata Sanjay Mahadao Nymhan Gram Sanskroty odyan, LSMNGSU"
Pune,Shreemant Dagdusheth Halwai Ganpati Mandir,Spiritual sites,"SDHGM, ShreemantDagdushethHalwaiGanpatiMandir, Shraamant Dagdoshath Halway Ganpaty Mandyr"
Pune,Parvati Hill & Hill top Temples,Spiritual sites,"ParvatiHill&HilltopTemples, Parvaty Hyll & Hyll top Tamplas, PH&HtT"
Pune,Shri Chatushrungi Devi Temple,Spiritual sites,"SCDT, Shry Chatoshrongy Davy Tampla, ShriChatushrungiDeviTemple"
Pune,Shri Siddhivinayak Ganesh Mandir Sarasbaug,Spiritual sites,"SSGMS, Shry Syddhyvynayak Ganash Mandyr Sarasbaog, ShriSiddhivinayakGaneshMandirSarasbaug"
Pune,Mahadji Shinde Chhatri,Spiritual sites,"MSC, MahadjiShindeChhatri, Mahadjy Shynda Chhatry"
Pune,ISKCON NVCC Pune,Spiritual sites,"ySKCoN NVCC Pona, INP, ISKCONNVCCPune"
Pune,"Shri Khandoba Mandir, Jejuri",Spiritual sites,"Shry Khandoba Mandyr, Jajory, ShriKhandobaMandir,Jejuri, SKMJ"
Pune,Bhuleshwar Temple,Spiritual sites,"BhuleshwarTemple, BT, Bholashwar Tampla"
Pune,BAPS Shri Swaminarayan Mandir Pune,Spiritual sites,"BSSMP, BAPSShriSwaminarayanMandirPune, BaPS Shry Swamynarayan Mandyr Pona"
Pune,"Katraj Jain Temple, Aagam Mandir",Spiritual sites,"KatrajJainTemple,AagamMandir, KJTAM, Katraj Jayn Tampla, aagam Mandyr"
Pune,St. Patrick's Cathedral,Spiritual sites,"St. Patrick’s Cathedral, St.Patrick'sCathedral, SPC, St. Patryck's Cathadral"
Pune,Prati Balaji Mandir,Spiritual sites,"PBM, PratiBalajiMandir, Praty Balajy Mandyr"
Pune,Bhimashankar Jyotirlinga,Spiritual sites,"Bhymashankar Jyotyrlynga, BhimashankarJyotirlinga, BJ"
Pune,Shree Sant Dnyaneshwar Maharaj Samadhi Mandir,Spiritual sites,"Shraa Sant Dnyanashwar Maharaj Samadhy Mandyr, Shree Sant Dnyaneshwar Maharaj Samadhi Mandir, Alandi, ShreeSantDnyaneshwarMaharajSamadhiMandir, SSDMSM"
Pune,"Shri Prati Shirdi Sai Baba Temple, Shirgaon Ramdara temple",Spiritual sites,"ShriPratiShirdiSaiBabaTemple,ShirgaonRamdaratemple, Shri Prati Shirdi Sai Baba Temple, Shirgaon, SPSSBTSRt, Shry Praty Shyrdy Say Baba Tampla, Shyrgaon Ramdara tampla"
Pune,Shree Chintamani Vinayaka Temple Theur,Spiritual sites,"SCVTT, Shraa Chyntamany Vynayaka Tampla Thaor, ShreeChintamaniVinayakaTempleTheur"
Pune,Pashan Lake,Nature,"PashanLake, PL, Pashan Laka"
Pune,Osho Garden,Nature,"OG, OshoGarden, osho Gardan"
Pune,Pune-Okayama Friendship Garden,Nature,"Pune-OkayamaFriendshipGarden, PFG, Pona-okayama Fryandshyp Gardan"
Pune,Rajiv Gandhi Zoological Park,Nature,"RGZP, RajivGandhiZoologicalPark, Rajyv Gandhy Zoologycal Park"
Pune,Empress Botanical Garden,Nature,"EmpressBotanicalGarden, EBG, amprass Botanycal Gardan"
Pune,Khadakwasla Dam,Nature,"KD, KhadakwaslaDam"
Pune,Taljai Hills,Nature,"TH, Taljay Hylls, TaljaiHills"
Pune,Vetal Hill,Nature,"Vatal Hyll, VetalHill, VH"
Pune,Mula Mutha River,Nature,"MMR, Mola Motha Ryvar, MulaMuthaRiver"
Pune,Lavasa,Nature,
Pune,Chhatrapati Sambhaji Maharaj garden,Nature,"CSMg, Chhatrapaty Sambhajy Maharaj gardan, ChhatrapatiSambhajiMaharajgarden"
Rishikesh,Rishikesh bus station,Transport,"Rishikeshbusstation, Ryshykash bos statyon, Rbs"
Rishikesh,Jolly Grant Airport - Dehradun,Transport,"JGA-D, Jolly Grant ayrport - Dahradon, JollyGrantAirport-Dehradun"
Rishikesh,Railway station rishikesh,Transport,"Raylway statyon ryshykash, Rsr, Railwaystationrishikesh"
Rishikesh,Ram jhula,Iconic Bridges,"Ram jhola, Ramjhula, Rj"
Rishikesh,Lakshman Jhula,Iconic Bridges,"Lakshman Jhola, LakshmanJhula, LJ"
Rishikesh,Janki Jhula,Iconic Bridges,"Janky Jhola, JJ, JankiJhula"
Rishikesh,Ganga Beach,Nature,"GangaBeach, GB, Ganga Baach"
Rishikesh,Goa Beach Rishikesh,Nature,"GoaBeachRishikesh, GBR, Goa Baach Ryshykash"
Rishikesh,Neer Waterfall,Nature,"NW, Naar Watarfall, NeerWaterfall"
Rishikesh,The Secret Waterfall,Nature,"TheSecretWaterfall, TSW, Tha Sacrat Watarfall"
Rishikesh,Patna Garud Chatti Waterfall,Nature,"PGCW, PatnaGarudChattiWaterfall, Patna Garod Chatty Watarfall"
Rishikesh,Shivpuri (River Rafting),Nature,"S(R, Shivpuri(RiverRafting), Shyvpory (Ryvar Raftyng)"
Rishikesh,Rajaji National Park,Nature,"RNP, Rajajy Natyonal Park, RajajiNationalPark"
Rishikesh,Marine Drive (Aastha Path),Nature,"MarineDrive(AasthaPath), Maryna Dryva (aastha Path), MD(P, Marine Drive( Aastha Path )"
Rishikesh,The Beatles Ashram,Spiritual sites,"TheBeatlesAshram, TBA, Tha Baatlas ashram"
Rishikesh,(Tera Manzil Temple) Trayambakeshwar Temple,Spiritual sites,"(Tara Manzyl Tampla) Trayambakashwar Tampla, (MTTT, (TeraManzilTemple)TrayambakeshwarTemple"
Rishikesh,Parmarth Niketan Ashram,Spiritual sites,"ParmarthNiketanAshram, Parmarth Nykatan ashram, PNA"
Rishikesh,Shatrughana Temple Ghat aarti,Spiritual sites,"ShatrughanaTempleGhataarti, STGa, Shatroghana Tampla Ghat aarty"
Rishikesh,Triveni Ghat Rishikesh,Spiritual sites,"Tryvany Ghat Ryshykash, TriveniGhatRishikesh, TGR"
Rishikesh,Gurdwara Sri Hemkunt Sahib,Spiritual sites,"GSHS, GurdwaraSriHemkuntSahib, Gordwara Sry Hamkont Sahyb"
Rishikesh,Kunjapuri Mata Ancient Temple & Sunrise Trek,Spiritual sites,"KMAT&ST, Konjapory Mata ancyant Tampla & Sonrysa Trak, KunjapuriMataAncientTemple&SunriseTrek"
Rishikesh,Vashishtha Gufa Temple,Spiritual sites,"Vashyshtha Gofa Tampla, VGT, VashishthaGufaTemple"
Rishikesh,Shree Neelkanth Mahadev Temple,Spiritual sites,"ShreeNeelkanthMahadevTemple, Shraa Naalkanth Mahadav Tampla, SNMT"
Shimla,Shimla Airport (Jubbarhatti Airport),Transport,"SA(A, ShimlaAirport(JubbarhattiAirport), Shymla ayrport (Jobbarhatty ayrport)"
Shimla,ISBT Shimla ( New Bus stand),Transport,"ISBTShimla(NewBusstand), ySBT Shymla ( Naw Bos stand), IS(NBs"
Shimla,Shimla Railway station,Transport,"ShimlaRailwaystation, SRs, Shymla Raylway statyon"
Shimla,Old bus stand shimla,Transport,"Oldbusstandshimla, Obss, old bos stand shymla"
Shimla,Ridge Mall road,Market,"RidgeMallroad, Rydga Mall road, RMr"
Shimla,Lakkar bazar,Market,"Lakkarbazar, Lb"
Shimla,Tibetan Refugee Market,Market,"TibetanRefugeeMarket, Tybatan Rafogaa Markat, TRM"
Shimla,Christ Church,Spiritual sites,"Chryst Chorch, CC, ChristChurch"
Shimla,"Shri Hanuman Temple, Jakhoo",Spiritual sites,"ShriHanumanTemple,Jakhoo, Shry Hanoman Tampla, Jakhoo, SHTJ"
Shimla,Dorje Drak Monastery,Spiritual sites,"DDM, Dorja Drak Monastary, DorjeDrakMonastery"
Shimla,St. Michael's Catholic Cathedral,Spiritual sites,"SMCC, St. Mychaal's Catholyc Cathadral, St.Michael'sCatholicCathedral"
Shimla,Kali Bari Temple,Spiritual sites,"KaliBariTemple, KBT, Kaly Bary Tampla"
Shimla,Tara Devi Temple,Spiritual sites,"Tara Davy Tampla, TDT, TaraDeviTemple"
Shimla,Baba Bhalku Rail Museum,Art and museum,"BBRM, Baba Bhalko Rayl Mosaom, BabaBhalkuRailMuseum"
Shimla,Gaiety Heritage Cultural Complex,Art and museum,"Gayaty Harytaga Coltoral Complax, GaietyHeritageCulturalComplex, GHCC"
Shimla,Bantony Castle,Art and museum,"BC, BantonyCastle, Bantony Castla"
Shimla,Army Heritage Museum & Annadale Ground,Art and museum,"AHM&AG, ArmyHeritageMuseum&AnnadaleGround, army Harytaga Mosaom & annadala Groond"
Shimla,Himachal State Museum,Art and museum,"Hymachal Stata Mosaom, HimachalStateMuseum, HSM"
Shimla,Viceregal Lodge,Art and museum,"ViceregalLodge, VL, Vycaragal Lodga"
Shimla,Chadwick Falls,Nature,"Chadwyck Falls, ChadwickFalls, CF"
Shimla,Himalayan Bird Park,Nature,"HBP, Hymalayan Byrd Park, HimalayanBirdPark"
Shimla,Kufri Horse Ride,Nature,"KufriHorseRide, KHR, Kofry Horsa Ryda"
Shimla,Himalayan Nature Park Kufri,Nature,"HimalayanNatureParkKufri, HNPK, Hymalayan Natora Park Kofry"
Shimla,"Apple garden Naldehra, RHRTS Mashobra",Nature,"AgNRM, ApplegardenNaldehra,RHRTSMashobra, appla gardan Naldahra, RHRTS Mashobra"
Shimla,Carignano Nature Park,Nature,"CNP, CarignanoNaturePark, Carygnano Natora Park"
Shimla,Cycling in Wildlife Sanctuary,Nature,"CiWS, CyclinginWildlifeSanctuary, Cyclyng yn Wyldlyfa Sanctoary"
Shimla,Water Rafting in Tattapani,Activity,"Watar Raftyng yn Tattapany, WaterRaftinginTattapani, WRiT"
Shimla,Ice Skating Ring,Activity,"IceSkatingRing, ISR, yca Skatyng Ryng"
Shimla,Naldehra Golf Course,Activity,"Naldahra Golf Coorsa, NGC, NaldehraGolfCourse"
Shimla,Nagsons Amusement Park,Activity,"NAP, NagsonsAmusementPark, Nagsons amosamant Park"
Shimla,Kufri Fun World,Activity,"KufriFunWorld, KFW, Kofry Fon World"
Shimla,Adventure Resorts,Activity,"AR, advantora Rasorts, AdventureResorts"
Srinagar,TRC Bus Stand Srinagar,Transport,"TRCBusStandSrinagar, TBSS, TRC Bos Stand Srynagar"
Srinagar,Srinagar railway station,Transport,"Srynagar raylway statyon, Srinagarrailwaystation, Srs"
Srinagar,(Srinagar Airport) Sheikh ul-Alam International Airport,Transport,"(ASuIA, (Srinagar Airport) Sheikh ul-Alam International Airport , (SrinagarAirport)Sheikhul-AlamInternationalAirport, (Srynagar ayrport) Shaykh ol-alam yntarnatyonal ayrport"
Srinagar,Parimpora Bus Stand,Transport,"PBS, ParimporaBusStand, Parympora Bos Stand"
Srinagar,Dal Lake,Water body,"DL, Dal Laka, DalLake"
Srinagar,Nigeen Lake,Water body,"Nygaan Laka, NL, NigeenLake"
Srinagar,Anchar Lake,Water body,"AL, AncharLake, anchar Laka"
Srinagar,Jhelum River,Water body,"Jhalom Ryvar, JhelumRiver, JR"
Srinagar,Shalimar Bagh Mughal Garden,Nature,"ShalimarBaghMughalGarden, SBMG, Shalymar Bagh Moghal Gardan"
Srinagar,Tulip Garden Indira Gandhi Memorial,Nature,"TulipGardenIndiraGandhiMemorial, TGIGM, Tulip Garden Indira Gandhi Memorial , Tolyp Gardan yndyra Gandhy Mamoryal"
Srinagar,Dachigam National Park,Nature,"DachigamNationalPark, DNP, Dachygam Natyonal Park"
Srinagar,Nishat Garden,Nature,"Nyshat Gardan, NishatGarden, NG"
