City,Location,Layer,synonyms
Srinagar,Cheshma Shahi Garden,Nature,"CheshmaShahiGarden, CSG, Chashma Shahy Gardan"
Srinagar,Botanical Garden Jawaharlal Nehru Memorial,Nature,"BGJNM, BotanicalGardenJawaharlalNehruMemorial, Botanycal Gardan Jawaharlal Nahro Mamoryal"
Srinagar,Badam Wari Park,Nature,"BadamWariPark, BWP, Badam Wary Park"
Srinagar,Gulmarg Gondola,Nature,"GG, Golmarg Gondola, GulmargGondola"
Srinagar,Char Chinar in Dal lake,Nature,"CharChinarinDallake, Char Chynar yn Dal laka, CCiDl"
Srinagar,Hokersar Wetland,Nature,"HokersarWetland, HW, Hokarsar Watland"
Srinagar,Harwan Garden,Nature,"Harwan Gardan, HG, HarwanGarden"
Srinagar,Doodhpathri (Meadow valley),Nature,"Doodhpathri(Meadowvalley), Doodhpathry (Maadow vallay), D(v"
Srinagar,Pari Mahal,Fort & Palace,"Pary Mahal, PM, PariMahal"
Srinagar,Hari Parbat Fort,Fort & Palace,"Hary Parbat Fort, HPF, HariParbatFort"
Srinagar,Sri Shankaracharya Temple,Spiritual sites,"Sry Shankaracharya Tampla, SriShankaracharyaTemple, SST"
Srinagar,Gurudwara Chati Patshahi,Spiritual sites,"GCP, GurudwaraChatiPatshahi, Gorodwara Chaty Patshahy"
Srinagar,Sri Kheer Bhawani Durga Temple,Spiritual sites,"SriKheerBhawaniDurgaTemple, SKBDT, Sry Khaar Bhawany Dorga Tampla"
Srinagar,Dargah Hazratbal Shrine,Spiritual sites,"DargahHazratbalShrine, Dargah Hazratbal Shryna, DHS"
Srinagar,Jamia Masjid Srinagar,Spiritual sites,"JamiaMasjidSrinagar, JMS, Jamya Masjyd Srynagar"
Srinagar,Pather Masjid,Spiritual sites,"PM, PatherMasjid, Pathar Masjyd"
Srinagar,Lal Chowk,Market,"LalChowk, LC"
Srinagar,Polo view market,Market,"Polo vyaw markat, Poloviewmarket, Pvm"
Srinagar,Kashmir Government Arts Emporium,Market,"KashmirGovernmentArtsEmporium, KGAE, Kashmyr Govarnmant arts amporyom"
Udaipur,"Maharana Pratap Airport, Udaipur",Transport,"MaharanaPratapAirport,Udaipur, MPAU, Maharana Pratap ayrport, odaypor"
Udaipur,Udaipur City Railway Station,Transport,"odaypor Cyty Raylway Statyon, UdaipurCityRailwayStation, UCRS"
Udaipur,Ranapratapnagar railway station,Transport,"Rrs, Ranapratapnagarrailwaystation, Ranapratapnagar raylway statyon"
Udaipur,Udaipole Bus Stand,Transport,"UdaipoleBusStand, UBS, odaypola Bos Stand"
Udaipur,Chetak Bus Stand,Transport,"CBS, ChetakBusStand, Chatak Bos Stand"
Udaipur,City Palace,Fort and Iconic structures,"CityPalace, Cyty Palaca, CP"
Udaipur,Jagmandir Island Palace,Fort and Iconic structures,"JagmandirIslandPalace, Jagmandyr ysland Palaca, JIP"
Udaipur,"Taj Lake Palace, Udaipur",Fort and Iconic structures,"Taj Laka Palaca, odaypor, TajLakePalace,Udaipur, TLPU"
Udaipur,Bagore Ki Haveli,Fort and Iconic structures,"BagoreKiHaveli, Bagora Ky Havaly, BKH"
Udaipur,Sajjangarh Monsoon Palace,Fort and Iconic structures,"Sajjangarh Monsoon Palaca, SMP, SajjangarhMonsoonPalace"
Udaipur,Ahar Royal Cenotaphs,Fort and Iconic structures,"ahar Royal Canotaphs, AharRoyalCenotaphs, ARC"
Udaipur,Jagdish Temple,Spiritual sites,"JagdishTemple, JT, Jagdysh Tampla"
Udaipur,Eklingji Temple,Spiritual sites,"ET, EklingjiTemple, aklyngjy Tampla"
Udaipur,"Karni Mata Temple, Udaipur",Spiritual sites,"Karny Mata Tampla, odaypor, KarniMataTemple,Udaipur, KMTU"
Udaipur,Neemach Mata Mandir,Spiritual sites,"NMM, Naamach Mata Mandyr, NeemachMataMandir"
Udaipur,Bohra Ganeshji Temple,Spiritual sites,"BGT, BohraGaneshjiTemple, Bohra Ganashjy Tampla"
Udaipur,Shilpgram,Art and museum,Shylpgram
Udaipur,Vintage Car Museum,Art and museum,"VCM, Vyntaga Car Mosaom, VintageCarMuseum"
Udaipur,Ahar Museum,Art and museum,"AharMuseum, AM, ahar Mosaom"
Udaipur,Haldighati Maharana Pratap Museum,Art and museum,"Haldyghaty Maharana Pratap Mosaom, HaldighatiMaharanaPratapMuseum, HMPM"
Udaipur,Pratap Gaurav Kendra Udaipur,Art and museum,"PGKU, Pratap Gaorav Kandra odaypor, PratapGauravKendraUdaipur"
Udaipur,Saheliyon ki bari,Nature,"Saheliyonkibari, Skb, Sahalyyon ky bary"
Udaipur,Lake Pichola,Nature,"LakePichola, LP, Laka Pychola"
Udaipur,Fateh Sagar Lake,Nature,"FatehSagarLake, Fatah Sagar Laka, FSL"
Udaipur,Badi Lake,Nature,"BadiLake, Badi Lake , Bady Laka, BL"
Udaipur,Gulab Bagh,Nature,"Golab Bagh, GB, GulabBagh"
Udaipur,Rajiv Gandhi Garden,Nature,"RGG, RajivGandhiGarden, Rajyv Gandhy Gardan"
Udaipur,Sajjan Garh Biological Park,Nature,"SajjanGarhBiologicalPark, Sajjan Garh Byologycal Park, SGBP"
Varanasi,Varanasi Airport (Lal Bahadur Shastri International),Transport,"VaranasiAirport(LalBahadurShastriInternational), VA(BSI, Varanasy ayrport (Lal Bahador Shastry yntarnatyonal)"
Varanasi,Varanasi Cantt Bus Stand,Transport,"VaranasiCanttBusStand, VCBS, Varanasy Cantt Bos Stand"
Varanasi,Varanasi Junction railway station (BSB),Transport,"Varanasy Jonctyon raylway statyon (BSB), VJrs(, VaranasiJunctionrailwaystation(BSB)"
Varanasi,Varanasi City Railway Station (BCY),Transport,"VCRS(, VaranasiCityRailwayStation(BCY), Varanasy Cyty Raylway Statyon (BCY)"
Varanasi,Deen Dayal Railway Station,Transport,"Daan Dayal Raylway Statyon, DeenDayalRailwayStation, DDRS"
Varanasi,Manduadih Banaras Railway Station (BSBS),Transport,"Mandoadyh Banaras Raylway Statyon (BSBS), ManduadihBanarasRailwayStation(BSBS), MBRS("
Varanasi,Lakhaniya Hills & Waterfall,Nature,"LH&W, LakhaniyaHills&Waterfall, Lakhanyya Hylls & Watarfall"
Varanasi,Rajdari and Devdari Waterfalls,Nature,"RajdariandDevdariWaterfalls, RaDW, Rajdary and Davdary Watarfalls"
Varanasi,Shri Kashi Vishwanath Temple,Spiritual sites,"SKVT, Shry Kashy Vyshwanath Tampla, ShriKashiVishwanathTemple"
Varanasi,Dashashwamedh Ghat,Spiritual sites,"Dashashwamadh Ghat, DG, DashashwamedhGhat"
Varanasi,Manikarnika Mahashamshan Ghat,Spiritual sites,"MMG, Manykarnyka Mahashamshan Ghat, ManikarnikaMahashamshanGhat"
Varanasi,Assi Ghat,Spiritual sites,"AG, assy Ghat, AssiGhat"
Varanasi,Shri Satyanarayan Tulsi Manas Mandir,Spiritual sites,"Shry Satyanarayan Tolsy Manas Mandyr, ShriSatyanarayanTulsiManasMandir, SSTMM"
Varanasi,ISKCON Temple Varanasi,Spiritual sites,"ISKCONTempleVaranasi, ySKCoN Tampla Varanasy, ITV"
Varanasi,Kaal Bhairav Temple,Spiritual sites,"KaalBhairavTemple, Kaal Bhayrav Tampla, KBT"
Varanasi,Swarved Mahamandir Dham,Spiritual sites,"SMD, SwarvedMahamandirDham, Swarvad Mahamandyr Dham"
Varanasi,Namo Ghat,Spiritual sites,"NamoGhat, NG"
Varanasi,Alamgir Masjid,Spiritual sites,"alamgyr Masjyd, AlamgirMasjid, AM"
Varanasi,Pujari Maa Vindhyavasini Temple,Spiritual sites,"Pojary Maa Vyndhyavasyny Tampla, PMVT, PujariMaaVindhyavasiniTemple"
Varanasi,"Shri Kashi Vishwanath Temple, BHU Campus",Spiritual sites,"SKVTBC, Shry Kashy Vyshwanath Tampla, BHo Campos, ShriKashiVishwanathTemple,BHUCampus"
Varanasi,Sankat Mochan Hanuman Mandir,Spiritual sites,"SankatMochanHanumanMandir, SMHM, Sankat Mochan Hanoman Mandyr"
Varanasi,Sant Kabir Math Lahartara,Spiritual sites,"Sant Kabyr Math Lahartara, SKML, SantKabirMathLahartara"
Varanasi,Ramnagar Fort,Fort and Iconic structures,"RamnagarFort, RF"
Varanasi,Archaeological Buddhist Remains of Sarnath,Fort and Iconic structures,"archaaologycal Boddhyst Ramayns of Sarnath, ABRoS, ArchaeologicalBuddhistRemainsofSarnath"
Varanasi,Chunar Fort,Fort and Iconic structures,"ChunarFort, Chonar Fort, CF"
Varanasi,Chet Singh Ghat,Fort and Iconic structures,"ChetSinghGhat, Chat Syngh Ghat, CSG"
Varanasi,Jantar Mantar & Man Singh Observatory,Museums and Iconic institutions,"JM&MSO, JantarMantar&ManSinghObservatory, Jantar Mantar & Man Syngh obsarvatory"
Varanasi,Bharat Kala Bhavan Museum,Museums and Iconic institutions,"Bharat Kala Bhavan Mosaom, BKBM, BharatKalaBhavanMuseum"
Varanasi,RUDRAKSH - International Convention Centre,Museums and Iconic institutions,"RoDRaKSH - yntarnatyonal Convantyon Cantra, RUDRAKSH-InternationalConventionCentre, R-ICC"
